{
  "@type": [
    "ada:imageMap",
    "schema:ImageObject"
  ],
  "ada:componentType": {
    "@type": "ada:SEMEDSElementalMap"
  },
  "ada:acquisitionTime": "2024-03-15T14:35:00Z",
  "ada:channel1": "Fe Ka",
  "ada:illuminationType": "Electron beam",
  "ada:imageType": "X-ray intensity map",
  "ada:numPixelsX": 1024,
  "ada:numPixelsY": 768,
  "ada:spatialRegistration": {
    "ada:originX": 0.0,
    "ada:originY": 0.0,
    "ada:pixelScaleX": 0.25,
    "ada:pixelScaleY": 0.25,
    "ada:pixelUnits": "micrometer",
    "ada:originLocation": "upperLeft",
    "ada:coordDef": "pixel-defined"
  }
}